{
  "version": "1.0",
  "work_item_types": {
    "UserStory": {
      "fields": [
        {
          "name": "AI Session ID",
          "reference": "Custom.AISessionID",
          "type": "string",
          "required": false,
          "fallback_reference": "System.Tags",
          "fallback_display_name": "Tags"
        },
        {
          "name": "AI Model Used",
          "reference": "Custom.AIModelUsed",
          "type": "string",
          "required": false,
          "fallback_reference": "System.Tags",
          "fallback_display_name": "Tags"
        },
        {
          "name": "AI Input Tokens",
          "reference": "Custom.AIInputTokens",
          "type": "integer",
          "required": false,
          "fallback_reference": "Microsoft.VSTS.Scheduling.StoryPoints",
          "fallback_display_name": "Story Points"
        },
        {
          "name": "AI Output Tokens",
          "reference": "Custom.AIOutputTokens",
          "type": "integer",
          "required": false,
          "fallback_reference": null,
          "fallback_display_name": null
        },
        {
          "name": "AI Cache Tokens",
          "reference": "Custom.AICacheTokens",
          "type": "integer",
          "required": false,
          "fallback_reference": null,
          "fallback_display_name": null
        },
        {
          "name": "AI Estimated Cost USD",
          "reference": "Custom.AIEstimatedCostUSD",
          "type": "double",
          "required": false,
          "fallback_reference": null,
          "fallback_display_name": null
        },
        {
          "name": "AI Session Duration Sec",
          "reference": "Custom.AISessionDurationSec",
          "type": "integer",
          "required": false,
          "fallback_reference": null,
          "fallback_display_name": null
        },
        {
          "name": "AI Tool Calls",
          "reference": "Custom.AIToolCalls",
          "type": "integer",
          "required": false,
          "fallback_reference": null,
          "fallback_display_name": null
        },
        {
          "name": "AI Tool Accept Rate Pct",
          "reference": "Custom.AIToolAcceptRatePct",
          "type": "double",
          "required": false,
          "fallback_reference": null,
          "fallback_display_name": null
        },
        {
          "name": "AI API Errors",
          "reference": "Custom.AIAPIErrors",
          "type": "integer",
          "required": false,
          "fallback_reference": null,
          "fallback_display_name": null
        },
        {
          "name": "AI Cache Hit Rate Pct",
          "reference": "Custom.AICacheHitRatePct",
          "type": "double",
          "required": false,
          "fallback_reference": null,
          "fallback_display_name": null
        },
        {
          "name": "Speckit Phase",
          "reference": "Custom.SpeckitPhase",
          "type": "picklistString",
          "picklist": [ "Spec", "Plan", "Tasks", "Analyze", "Implement" ],
          "required": false,
          "fallback_reference": "System.Tags",
          "fallback_display_name": "Tags"
        }
      ]
    },
    "Task": {
      "fields": [
        {
          "name": "AI Session ID",
          "reference": "Custom.AISessionID",
          "type": "string",
          "required": false,
          "fallback_reference": "System.Tags",
          "fallback_display_name": "Tags"
        },
        {
          "name": "AI Model Used",
          "reference": "Custom.AIModelUsed",
          "type": "string",
          "required": false,
          "fallback_reference": "System.Tags",
          "fallback_display_name": "Tags"
        }
      ]
    }
  },
  "fallback_strategy": {
    "string": "System.Tags",
    "integer": "Microsoft.VSTS.Scheduling.StoryPoints",
    "double": null,
    "picklistString": "System.Tags"
  },
  "tags_encoding": "pipe_separated_kv"
}
